{
  "catalogueId": "HDIP-CLA-A3-INVARIANT-CONFORMANCE-CATALOGUE",
  "catalogueVersion": "0.1",
  "status": "COMPLETE",
  "humanReadableAuthority": [
    "docs/architecture/cla/hdip-cla-0.1-m16-architecture-invariants-conformance-model.md",
    "docs/architecture/cla/hdip-cla-0.1-m17-cross-artifact-reconciliation-freeze.md"
  ],
  "a1IdentityRegistry": "/specs/hdip-cla/0.1/a1/architecture-element-registry.json",
  "a2RelationshipTraceabilityRegistry": "/specs/hdip-cla/0.1/a2/relationship-traceability-registry.json",
  "fidelityPolicy": {
    "humanReadablePrecedence": true,
    "noSilentRedesign": true,
    "assessmentModeBoundaryPreserved": true,
    "conditionalPositiveOutcomeDefined": false,
    "note": "A3 formalizes M16 conformance semantics. It does not make HYBRID or ASSESSMENT invariants machine-decidable."
  },
  "summary": {
    "architectureInvariants": 48,
    "invariantFamilies": 7,
    "assessmentModes": 3,
    "applicabilityStates": 3,
    "invariantResults": 4,
    "conformanceSubjectClasses": 6,
    "claimTypes": 3,
    "overallOutcomes": 3,
    "evidencePackageDimensions": 18,
    "profileDimensions": 18,
    "permittedProfileOperations": 9,
    "prohibitedProfileOperations": 14,
    "antiPatterns": 20,
    "normativeRules": 64
  },
  "invariantFamilies": [
    {
      "number": 1,
      "name": "Authority, semantics and jurisdiction",
      "members": [
        "M16-I01",
        "M16-I02",
        "M16-I03",
        "M16-I04",
        "M16-I05",
        "M16-I06",
        "M16-I07"
      ]
    },
    {
      "number": 2,
      "name": "Responsibility, structure and topology",
      "members": [
        "M16-I08",
        "M16-I09",
        "M16-I10",
        "M16-I11",
        "M16-I12",
        "M16-I13",
        "M16-I14",
        "M16-I15"
      ]
    },
    {
      "number": 3,
      "name": "Data, Information, Intelligence and Product identity",
      "members": [
        "M16-I16",
        "M16-I17",
        "M16-I18",
        "M16-I19",
        "M16-I20",
        "M16-I21"
      ]
    },
    {
      "number": 4,
      "name": "Governed self-service, lifecycle and experience",
      "members": [
        "M16-I22",
        "M16-I23",
        "M16-I24",
        "M16-I25",
        "M16-I26",
        "M16-I27",
        "M16-I28"
      ]
    },
    {
      "number": 5,
      "name": "Projection, compilation, registry and discovery",
      "members": [
        "M16-I29",
        "M16-I30",
        "M16-I31",
        "M16-I32",
        "M16-I33",
        "M16-I34"
      ]
    },
    {
      "number": 6,
      "name": "Evidence, trust, version and historical meaning",
      "members": [
        "M16-I35",
        "M16-I36",
        "M16-I37",
        "M16-I38",
        "M16-I39",
        "M16-I40"
      ]
    },
    {
      "number": 7,
      "name": "Derived conformance closure",
      "members": [
        "M16-I41",
        "M16-I42",
        "M16-I43",
        "M16-I44",
        "M16-I45",
        "M16-I46",
        "M16-I47",
        "M16-I48"
      ]
    }
  ],
  "assessmentModes": [
    {
      "token": "STRUCTURAL",
      "meaning": "Material portions can be checked from declared architecture structure, identifiers, mappings or versioned configuration.",
      "typicalEvidence": "Architecture registry, mapping graph/table, declared lifecycle/profile structure, identifier/version checks.",
      "automationCeiling": "May support decisive machine checks only for conditions fully represented by the formal artifacts; does not prove runtime correctness or assurance."
    },
    {
      "token": "HYBRID",
      "meaning": "Structural checks are useful but sufficient assessment also requires interpretation of authority, semantics, behavior, evidence or context.",
      "typicalEvidence": "Structural evidence plus architecture review, contract evidence, policy/currentness evidence, runtime samples.",
      "automationCeiling": "Machine checks may support assessment; accountable review is required for final satisfaction."
    },
    {
      "token": "ASSESSMENT",
      "meaning": "Accountable judgement is primary; machine checks can support but cannot safely determine the conclusion by themselves.",
      "typicalEvidence": "Architecture rationale, assurance review, contextual trust/fitness assessment, governance judgement.",
      "automationCeiling": "Machine support only; final satisfaction cannot be asserted automatically."
    }
  ],
  "applicabilityStates": [
    {
      "token": "APPLICABLE",
      "meaning": "The invariant architectural condition materially arises within the assessed subject/scope.",
      "finalResultAllowed": [
        "SATISFIED",
        "VIOLATED",
        "INDETERMINATE"
      ]
    },
    {
      "token": "NOT_APPLICABLE",
      "meaning": "The condition genuinely does not arise in the bounded scope and that conclusion is justified.",
      "finalResultAllowed": [
        "NOT_APPLICABLE"
      ]
    },
    {
      "token": "UNDETERMINED",
      "meaning": "During assessment, applicability itself cannot yet be established.",
      "finalResultAllowed": [
        "INDETERMINATE"
      ],
      "assessmentStateOnly": true
    }
  ],
  "invariantResults": [
    {
      "token": "SATISFIED",
      "meaning": "The applicable invariant has sufficient evidence to establish satisfaction."
    },
    {
      "token": "VIOLATED",
      "meaning": "The applicable invariant is demonstrably violated."
    },
    {
      "token": "INDETERMINATE",
      "meaning": "Available evidence cannot establish satisfaction or violation with the confidence required by the invariant."
    },
    {
      "token": "NOT_APPLICABLE",
      "meaning": "The invariant condition genuinely does not arise in the bounded scope and the rationale is justified."
    }
  ],
  "conformanceSubjectClasses": [
    {
      "id": "CS1",
      "name": "Enterprise HDIP Architecture",
      "meaning": "Enterprise-wide or multi-domain HDIP target/current architecture."
    },
    {
      "id": "CS2",
      "name": "Domain / Portfolio HDIP Architecture",
      "meaning": "A Data, Information, Intelligence or cross-domain bounded architecture."
    },
    {
      "id": "CS3",
      "name": "Governed HDIP Profile",
      "meaning": "A concrete enterprise/domain/Product-family/high-assurance/Data-Mesh specialization."
    },
    {
      "id": "CS4",
      "name": "Platform / Solution Architecture",
      "meaning": "A bounded platform, solution or capability architecture claiming HDIP alignment."
    },
    {
      "id": "CS5",
      "name": "Product / Capability Realization Architecture",
      "meaning": "A bounded Product or non-Product capability realization using applicable PDEP/SSCF/runtime responsibilities."
    },
    {
      "id": "CS6",
      "name": "Concrete Realization Mapping",
      "meaning": "The mapping from canonical/Profile architecture into actual deployed/human/provider Realization Units."
    }
  ],
  "claimTypes": [
    {
      "token": "CORE_ARCHITECTURE_CONFORMANCE",
      "name": "Core Architecture Conformance",
      "meaning": "The subject preserves all applicable M16 core invariants and the applicable responsibilities/contracts of the HDIP-CLA 0.1 baseline."
    },
    {
      "token": "PROFILE_CONFORMANCE",
      "name": "Profile Conformance",
      "meaning": "The subject is Core-conformant and satisfies a named, governed, M16-valid HDIP Profile."
    },
    {
      "token": "REALIZATION_MAPPING_CONFORMANCE",
      "name": "Realization Mapping Conformance",
      "meaning": "A concrete implementation mapping faithfully realizes the claimed Core/Profile architecture, including traceability to Realization Units, M12 contracts, M13 boundaries/EBCs, evidence responsibilities, currentness and failure/recovery obligations."
    }
  ],
  "overallOutcomes": [
    {
      "token": "CONFORMANT",
      "meaning": "Every applicable core invariant is SATISFIED; N/A results have justified scope rationale; all obligations required by the claim type are satisfied."
    },
    {
      "token": "NONCONFORMANT",
      "meaning": "At least one applicable core invariant is VIOLATED, or a mandatory claim-type obligation is demonstrably violated."
    },
    {
      "token": "INDETERMINATE",
      "meaning": "No applicable core invariant is known to be violated, but one or more material applicable obligations cannot be determined with sufficient evidence."
    }
  ],
  "claimScopeMinimum": [
    "subject identity",
    "subject version",
    "claim type",
    "organizational / solution scope",
    "architecture boundary",
    "HDIP-CLA baseline version",
    "applicable Profile(s)",
    "assessment time / version"
  ],
  "evidencePackage": [
    {
      "number": 1,
      "name": "Subject identity/version",
      "minimumContent": "Stable subject ID and assessed version."
    },
    {
      "number": 2,
      "name": "Claim type",
      "minimumContent": "Core, Profile or Realization Mapping."
    },
    {
      "number": 3,
      "name": "Scope / architecture boundary",
      "minimumContent": "Organizational, solution, Product/capability and logical boundary."
    },
    {
      "number": 4,
      "name": "HDIP baseline",
      "minimumContent": "HDIP-CLA version used for assessment."
    },
    {
      "number": 5,
      "name": "Profile identity/version",
      "minimumContent": "Applicable concrete Profile(s), if any."
    },
    {
      "number": 6,
      "name": "External authority map",
      "minimumContent": "GEDRM/GEARM/GEAIRM, BPS/PIN, Product-family, policy/legal, Decision/action and other authorities relied upon."
    },
    {
      "number": 7,
      "name": "Plane responsibility coverage",
      "minimumContent": "Applicable P1-P5 responsibility coverage."
    },
    {
      "number": 8,
      "name": "Overlay applicability",
      "minimumContent": "X1-X9 applicability and evidence/control responsibilities."
    },
    {
      "number": 9,
      "name": "ABB / responsibility mapping",